Type 'help;' or '\h' for help. Type '\c' to clear the current input statement.

mysql> use gjj;
Database changed
mysql> create table shoucangbiao(id varchar(20) primary key unique,sc_name varchar(30),sc_jiage int,sc_time datetime,quxiao_sc enum('0','1'));
Query OK, 0 rows affected (0.11 sec)

mysql> alter table shoucangbiao change quxiao_sc quxiao_sc bit default 1;
Query OK, 0 rows affected (0.07 sec)
Records: 0  Duplicates: 0  Warnings: 0

mysql> desc shoucangbiao;
+-----------+-------------+------+-----+---------+-------+
| Field     | Type        | Null | Key | Default | Extra |
+-----------+-------------+------+-----+---------+-------+
| id        | varchar(20) | NO   | PRI | NULL    |       |
| sc_name   | varchar(30) | YES  |     | NULL    |       |
| sc_jiage  | int(11)     | YES  |     | NULL    |       |
| sc_time   | datetime    | YES  |     | NULL    |       |
| quxiao_sc | bit(1)      | YES  |     | b'1'    |       |
+-----------+-------------+------+-----+---------+-------+
5 rows in set (0.00 sec)

mysql> insert into shoucang(id,sc_name,sc_jiage,sc_time) values('1','NATA',200.00,now());
ERROR 1146 (42S02): Table 'gjj.shoucang' doesn't exist
mysql> insert into shoucangbiao(id,sc_name,sc_jiage,sc_time) values('1','NATA',200.00,now());
Query OK, 1 row affected (0.05 sec)

mysql> select * from shoucangbiao;
+----+---------+----------+---------------------+-----------+
| id | sc_name | sc_jiage | sc_time             | quxiao_sc |
+----+---------+----------+---------------------+-----------+
| 1  | NATA    |      200 | 2018-11-12 23:18:20 |          |
+----+---------+----------+---------------------+-----------+
1 row in set (0.00 sec)

mysql> insert into shoucangbiao(id,sc_name,sc_jiage,sc_time) values('2','nike',350.00,now());
Query OK, 1 row affected (0.03 sec)

mysql> insert into shoucangbiao(id,sc_name,sc_jiage,sc_time) values ('3','bosideng',400.00,now());
Query OK, 1 row affected (0.02 sec)

mysql> select * from shoucangbiao;
+----+----------+----------+---------------------+-----------+
| id | sc_name  | sc_jiage | sc_time             | quxiao_sc |
+----+----------+----------+---------------------+-----------+
| 1  | NATA     |      200 | 2018-11-12 23:18:20 |          |
| 2  | nike     |      350 | 2018-11-12 23:23:46 |          |
| 3  | bosideng |      400 | 2018-11-12 23:24:55 |          |
+----+----------+----------+---------------------+-----------+
3 rows in set (0.00 sec)

mysql> update shoucangbiao set quxiao_sc=0 where sc_name='nike';
Query OK, 1 row affected (0.06 sec)
Rows matched: 1  Changed: 1  Warnings: 0

mysql> select * from shoucangbiao;
+----+----------+----------+---------------------+-----------+
| id | sc_name  | sc_jiage | sc_time             | quxiao_sc |
+----+----------+----------+---------------------+-----------+
| 1  | NATA     |      200 | 2018-11-12 23:18:20 |          |
| 2  | nike     |      350 | 2018-11-12 23:23:46 |           |
| 3  | bosideng |      400 | 2018-11-12 23:24:55 |          |
+----+----------+----------+---------------------+-----------+
3 rows in set (0.00 sec)